<?xml version="1.0" encoding="UTF-8" standalone="yes"?>
<!-- 
	* Copyright 2008 Philippe Prados.
	*
	* Licensed under the Apache License, Version 2.0 (the "License");
	* you may not use this file except in compliance with the License.
	* You may obtain a copy of the License at
	*
	*      http://www.apache.org/licenses/LICENSE-2.0
	*
	* Unless required by applicable law or agreed to in writing, software
	* distributed under the License is distributed on an "AS IS" BASIS,
	* WITHOUT WARRANTIES OR CONDITIONS OF ANY KIND, either express or implied.
	* See the License for the specific language governing permissions and
	* limitations under the License.
	*

    $Id$
    $Log$
-->
<?xml-stylesheet href="audit.xslt" type="text/xsl"?>

<audit 
	xmlns="http://macaron.googlecode.com/1.0/"
	xmlns:xsi="http://www.w3.org/2001/XMLSchema-instance"
 	xsi:schemaLocation="http://macaron.googlecode.com/1.0/ http://macaron.googlecode.com/svn/trunk/audit/src/main/resources/com/googlecode/macaron/audit/audit.xsd"
	xmlns:xsl="http://www.w3.org/1999/XSL/Transform"	
	ignoreFilenames="^([^_]+_[a-z]{2}(_[A-Z]{2}(_[a-z]{1,3})?)?\.properties)|(.+\.(xsd|dtd|txt))$"
>
	<!-- Meme package, archives différentes -->
	<packages>
		<package name=""/>
		<package name="META-INF/"/>
		<package name="META-INF/services/"/>
	</packages>
	
	<!-- Meme noms, package différent -->
	<filenames>
		<filename name="MANIFEST.MF"/>
		<filename name="NOTICE"/>
		<filename name="NOTICE.txt"/>
		<filename name="LICENSE"/>
		<filename name="LICENSE.txt"/>
		<filename name="license.txt"/>
		<filename name="package.html"/>
		<filename name="overview.html"/>
		<filename name="INDEX.LIST"/>
		<filename name="jar.policy"/>
		<filename name="pom.xml"/>
		<filename name="pom.properties"/>
	</filenames>
	<!-- Même basename, même package -->
	<basenames>
		<basename name="META-INF/NOTICE"/>
		<basename name="META-INF/LICENSE"/>
	</basenames>
</audit>

