<?xml version="1.0" encoding="UTF-8" standalone="yes"?>
<?xml-stylesheet href="audit.xslt" type="text/xsl"?>


<!-- 
 * Copyright 2009 Philippe Prados.
 *
 * Licensed under the Apache License, Version 2.0 (the "License");
 * you may not use this file except in compliance with the License.
 * You may obtain a copy of the License at
 *
 *      http://www.apache.org/licenses/LICENSE-2.0
 *
 * Unless required by applicable law or agreed to in writing, software
 * distributed under the License is distributed on an "AS IS" BASIS,
 * WITHOUT WARRANTIES OR CONDITIONS OF ANY KIND, either express or implied.
 * See the License for the specific language governing permissions and
 * limitations under the License.
 *
-->

<audit 
	xmlns="http://macaron.googlecode.com/1.0/"
	xmlns:xsi="http://www.w3.org/2001/XMLSchema-instance"
	xsi:schemaLocation="http://macaron.googlecode.com/1.0/versions%20tools/xsd/audit.xsd"
	xmlns:xsl="http://www.w3.org/1999/XSL/Transform"	
	ignoreFilenames="^[^_]+_[a-z]{2}(_[A-Z]{2}(_[a-z]{1,3})?)?\.properties$"
>
	<!-- Meme package, archives diffÃ©rentes -->
	<packages>
		<package name="META-INF/"/>
		<package name="org/apache/catalina/loader/"/>
		<package name="org/apache/catalina/security/"/>
		<package name="org/apache/catalina/startup/"/>
		<package name="org/apache/catalina/util/"/>
		<package name="org/apache/naming/"/>
	</packages>
	
</audit>

